13:56:09.972920 IP ip-172-31-74-55.ec2.internal.30012 > 1353c458078e.http: Flags [S], seq 1206494593, win 26883, options [mss 8961,sackOK,TS val 639460054 ecr 0,nop,wscale 8], length 0
13:56:09.973152 IP ip-172-31-74-55.ec2.internal.30012 > 1353c458078e.http: Flags [.], ack 114682299, win 106, options [nop,nop,TS val 639460054 ecr 2152338526], length 0
13:56:09.973203 IP ip-172-31-74-55.ec2.internal.30012 > 1353c458078e.http: Flags [P.], seq 0:1413, ack 1, win 106, options [nop,nop,TS val 639460054 ecr 2152338526], length 1413: HTTP: GET /catalogsearch/result/?q=dieta+enteral+infantil HTTP/1.1
13:56:10.098981 IP ip-172-31-57-179.ec2.internal.27156 > 1353c458078e.http: Flags [F.], seq 3939619207, ack 4060891958, win 2574, options [nop,nop,TS val 24767134 ecr 1020256565], length 0
13:56:10.248031 IP 1353c458078e.59032 > ip-108-170-62-131.searchanise.com.http: Flags [S], seq 391394914, win 29200, options [mss 1460,sackOK,TS val 3374573676 ecr 0,nop,wscale 7], length 0
13:56:10.315264 IP 1353c458078e.59032 > ip-108-170-62-131.searchanise.com.http: Flags [.], ack 453529961, win 229, options [nop,nop,TS val 3374573743 ecr 1374319317], length 0
13:56:10.315340 IP 1353c458078e.59032 > ip-108-170-62-131.searchanise.com.http: Flags [P.], seq 0:568, ack 1, win 229, options [nop,nop,TS val 3374573743 ecr 1374319317], length 568: HTTP: GET /search?items=true&facets=true&output=json&sortBy=relevance&sortOrder=desc&restrictBy%5Bstatus%5D=1&restrictBy%5Bvisibility%5D=3%7C4&union%5Bprice%5D%5Bmin%5D=se_price_0&startIndex=0&q=dieta+enteral+infantil&suggestions=true&query_correction=false&suggestionsMaxResults=1&maxResults=24&api_key=3p7e8h9m5g HTTP/1.0
13:56:10.473123 IP 1353c458078e.59032 > ip-108-170-62-131.searchanise.com.http: Flags [.], ack 851, win 242, options [nop,nop,TS val 3374573901 ecr 1374319475], length 0
13:56:10.473778 IP 1353c458078e.59032 > ip-108-170-62-131.searchanise.com.http: Flags [F.], seq 568, ack 852, win 242, options [nop,nop,TS val 3374573902 ecr 1374319475], length 0
13:56:10.502544 IP ip-172-31-57-179.ec2.internal.27154 > 1353c458078e.http: Flags [F.], seq 2769513725, ack 3883088736, win 117, options [nop,nop,TS val 24767235 ecr 1020256969], length 0
13:56:10.841359 IP ip-172-31-74-55.ec2.internal.30012 > 1353c458078e.http: Flags [.], ack 1449, win 117, options [nop,nop,TS val 639460271 ecr 2152339394], length 0
13:56:10.841381 IP ip-172-31-74-55.ec2.internal.30012 > 1353c458078e.http: Flags [.], ack 4345, win 139, options [nop,nop,TS val 639460271 ecr 2152339394], length 0
13:56:10.841411 IP ip-172-31-74-55.ec2.internal.30012 > 1353c458078e.http: Flags [.], ack 5793, win 151, options [nop,nop,TS val 639460271 ecr 2152339394], length 0
13:56:10.841441 IP ip-172-31-74-55.ec2.internal.30012 > 1353c458078e.http: Flags [.], ack 7241, win 162, options [nop,nop,TS val 639460271 ecr 2152339394], length 0
13:56:10.841479 IP ip-172-31-74-55.ec2.internal.30012 > 1353c458078e.http: Flags [.], ack 8689, win 173, options [nop,nop,TS val 639460271 ecr 2152339394], length 0
13:56:10.841498 IP ip-172-31-74-55.ec2.internal.30012 > 1353c458078e.http: Flags [.], ack 10137, win 185, options [nop,nop,TS val 639460271 ecr 2152339394], length 0
13:56:10.841534 IP ip-172-31-74-55.ec2.internal.30012 > 1353c458078e.http: Flags [.], ack 11585, win 196, options [nop,nop,TS val 639460271 ecr 2152339394], length 0
13:56:10.841621 IP ip-172-31-74-55.ec2.internal.30012 > 1353c458078e.http: Flags [.], ack 13033, win 207, options [nop,nop,TS val 639460271 ecr 2152339394], length 0
13:56:10.841690 IP ip-172-31-74-55.ec2.internal.30012 > 1353c458078e.http: Flags [.], ack 14481, win 219, options [nop,nop,TS val 639460271 ecr 2152339394], length 0
13:56:10.841711 IP ip-172-31-74-55.ec2.internal.30012 > 1353c458078e.http: Flags [.], ack 15929, win 230, options [nop,nop,TS val 639460271 ecr 2152339395], length 0
13:56:10.841742 IP ip-172-31-74-55.ec2.internal.30012 > 1353c458078e.http: Flags [.], ack 18825, win 253, options [nop,nop,TS val 639460271 ecr 2152339395], length 0
13:56:10.841766 IP ip-172-31-74-55.ec2.internal.30012 > 1353c458078e.http: Flags [.], ack 20308, win 264, options [nop,nop,TS val 639460271 ecr 2152339395], length 0
13:56:11.314296 IP ip-172-31-57-179.ec2.internal.27158 > 1353c458078e.http: Flags [S], seq 2013827071, win 26883, options [mss 8961,sackOK,TS val 24767438 ecr 0,nop,wscale 8], length 0
13:56:11.314851 IP ip-172-31-57-179.ec2.internal.27158 > 1353c458078e.http: Flags [.], ack 157521504, win 106, options [nop,nop,TS val 24767438 ecr 1020257781], length 0
13:56:11.314898 IP ip-172-31-57-179.ec2.internal.27158 > 1353c458078e.http: Flags [P.], seq 0:1884, ack 1, win 106, options [nop,nop,TS val 24767438 ecr 1020257781], length 1884: HTTP: GET /session.php HTTP/1.1
13:56:11.494058 IP ip-172-31-57-179.ec2.internal.27158 > 1353c458078e.http: Flags [.], ack 595, win 110, options [nop,nop,TS val 24767483 ecr 1020257961], length 0
13:56:13.459908 IP ip-172-31-74-55.ec2.internal.30016 > 1353c458078e.http: Flags [S], seq 813097625, win 26883, options [mss 8961,sackOK,TS val 639460925 ecr 0,nop,wscale 8], length 0
13:56:13.460161 IP ip-172-31-74-55.ec2.internal.30016 > 1353c458078e.http: Flags [.], ack 447613403, win 106, options [nop,nop,TS val 639460925 ecr 2152342013], length 0
13:56:13.460188 IP ip-172-31-74-55.ec2.internal.30016 > 1353c458078e.http: Flags [P.], seq 0:146, ack 1, win 106, options [nop,nop,TS val 639460925 ecr 2152342013], length 146: HTTP: GET /painelmagento HTTP/1.1
13:56:13.511159 IP ip-172-31-57-179.ec2.internal.27162 > 1353c458078e.http: Flags [S], seq 398534800, win 26883, options [mss 8961,sackOK,TS val 24767987 ecr 0,nop,wscale 8], length 0
13:56:13.511813 IP ip-172-31-57-179.ec2.internal.27162 > 1353c458078e.http: Flags [.], ack 2827953750, win 106, options [nop,nop,TS val 24767987 ecr 1020259978], length 0
13:56:13.511850 IP ip-172-31-57-179.ec2.internal.27162 > 1353c458078e.http: Flags [P.], seq 0:146, ack 1, win 106, options [nop,nop,TS val 24767987 ecr 1020259978], length 146: HTTP: GET /painelmagento HTTP/1.1
13:56:13.810477 IP ip-172-31-74-55.ec2.internal.30016 > 1353c458078e.http: Flags [.], ack 2897, win 128, options [nop,nop,TS val 639461013 ecr 2152342363], length 0
13:56:13.810486 IP ip-172-31-74-55.ec2.internal.30016 > 1353c458078e.http: Flags [.], ack 4287, win 139, options [nop,nop,TS val 639461013 ecr 2152342363], length 0
13:56:13.810582 IP ip-172-31-74-55.ec2.internal.30016 > 1353c458078e.http: Flags [F.], seq 146, ack 4288, win 139, options [nop,nop,TS val 639461013 ecr 2152342363], length 0
13:56:13.864333 IP ip-172-31-57-179.ec2.internal.27162 > 1353c458078e.http: Flags [.], ack 4286, win 139, options [nop,nop,TS val 24768075 ecr 1020260331], length 0
13:56:13.864436 IP ip-172-31-57-179.ec2.internal.27162 > 1353c458078e.http: Flags [F.], seq 146, ack 4287, win 139, options [nop,nop,TS val 24768075 ecr 1020260331], length 0
13:56:15.503723 IP ip-172-31-57-179.ec2.internal.27164 > 1353c458078e.http: Flags [S], seq 2166046823, win 26883, options [mss 8961,sackOK,TS val 24768485 ecr 0,nop,wscale 8], length 0
13:56:15.504243 IP ip-172-31-57-179.ec2.internal.27164 > 1353c458078e.http: Flags [.], ack 1116419005, win 106, options [nop,nop,TS val 24768485 ecr 1020261971], length 0
13:56:15.504286 IP ip-172-31-57-179.ec2.internal.27164 > 1353c458078e.http: Flags [P.], seq 0:437, ack 1, win 106, options [nop,nop,TS val 24768485 ecr 1020261971], length 437: HTTP: GET /marcas/isosource HTTP/1.1
13:56:15.841462 IP ip-172-31-74-55.ec2.internal.30012 > 1353c458078e.http: Flags [F.], seq 1413, ack 20309, win 264, options [nop,nop,TS val 639461521 ecr 2152344394], length 0
13:56:16.204674 IP ip-172-31-57-179.ec2.internal.27164 > 1353c458078e.http: Flags [.], ack 14481, win 219, options [nop,nop,TS val 24768660 ecr 1020262671], length 0
13:56:16.205338 IP ip-172-31-57-179.ec2.internal.27164 > 1353c458078e.http: Flags [.], ack 22054, win 278, options [nop,nop,TS val 24768660 ecr 1020262672], length 0
13:56:16.494201 IP ip-172-31-57-179.ec2.internal.27158 > 1353c458078e.http: Flags [F.], seq 1884, ack 596, win 110, options [nop,nop,TS val 24768733 ecr 1020262961], length 0
13:56:16.923772 IP ip-172-31-57-179.ec2.internal.27164 > 1353c458078e.http: Flags [P.], seq 437:978, ack 22054, win 278, options [nop,nop,TS val 24768840 ecr 1020262672], length 541: HTTP: GET /media/catalog/product/cache/1/small_image/263x/0dc2d03fe217f8c83829496872af24a0/I/s/Isosource-Soya-Fiber---1000-ml_07_7.jpg HTTP/1.1
13:56:16.926296 IP ip-172-31-57-179.ec2.internal.27164 > 1353c458078e.http: Flags [.], ack 28167, win 326, options [nop,nop,TS val 24768841 ecr 1020263393], length 0
13:56:17.000782 IP ip-172-31-74-55.ec2.internal.30018 > 1353c458078e.http: Flags [S], seq 2159092437, win 26883, options [mss 8961,sackOK,TS val 639461811 ecr 0,nop,wscale 8], length 0
13:56:17.000998 IP ip-172-31-74-55.ec2.internal.30018 > 1353c458078e.http: Flags [.], ack 2243184654, win 106, options [nop,nop,TS val 639461811 ecr 2152345554], length 0
13:56:17.001045 IP ip-172-31-74-55.ec2.internal.30018 > 1353c458078e.http: Flags [P.], seq 0:533, ack 1, win 106, options [nop,nop,TS val 639461811 ecr 2152345554], length 533: HTTP: GET /media/catalog/product/cache/1/small_image/263x/0dc2d03fe217f8c83829496872af24a0/I/S/ISOSOURCE-MIX-1000ML-__07_5.jpg HTTP/1.1
13:56:17.002986 IP ip-172-31-74-55.ec2.internal.30018 > 1353c458078e.http: Flags [.], ack 2897, win 128, options [nop,nop,TS val 639461811 ecr 2152345556], length 0
13:56:17.003012 IP ip-172-31-74-55.ec2.internal.30018 > 1353c458078e.http: Flags [.], ack 4345, win 139, options [nop,nop,TS val 639461811 ecr 2152345556], length 0
13:56:17.003054 IP ip-172-31-74-55.ec2.internal.30018 > 1353c458078e.http: Flags [.], ack 5517, win 151, options [nop,nop,TS val 639461811 ecr 2152345556], length 0
13:56:17.043855 IP ip-172-31-74-55.ec2.internal.30020 > 1353c458078e.http: Flags [S], seq 502846127, win 26883, options [mss 8961,sackOK,TS val 639461821 ecr 0,nop,wscale 8], length 0
13:56:17.044092 IP ip-172-31-74-55.ec2.internal.30020 > 1353c458078e.http: Flags [.], ack 3365089157, win 106, options [nop,nop,TS val 639461821 ecr 2152345597], length 0
13:56:17.044148 IP ip-172-31-74-55.ec2.internal.30020 > 1353c458078e.http: Flags [P.], seq 0:1324, ack 1, win 106, options [nop,nop,TS val 639461821 ecr 2152345597], length 1324: HTTP: GET /session.php HTTP/1.1
13:56:17.247480 IP ip-172-31-74-55.ec2.internal.30020 > 1353c458078e.http: Flags [.], ack 595, win 110, options [nop,nop,TS val 639461872 ecr 2152345800], length 0
13:56:18.034753 IP ip-172-31-57-179.ec2.internal.27164 > 1353c458078e.http: Flags [P.], seq 978:2868, ack 28167, win 326, options [nop,nop,TS val 24769118 ecr 1020263393], length 1890: HTTP: GET /session.php HTTP/1.1
13:56:18.234096 IP ip-172-31-57-179.ec2.internal.27164 > 1353c458078e.http: Flags [.], ack 28761, win 337, options [nop,nop,TS val 24769168 ecr 1020264701], length 0
13:56:18.742331 IP ip-172-31-57-179.ec2.internal.27164 > 1353c458078e.http: Flags [P.], seq 2868:3264, ack 28761, win 337, options [nop,nop,TS val 24769295 ecr 1020264701], length 396: HTTP: GET /erro HTTP/1.1
13:56:19.324145 IP ip-172-31-57-179.ec2.internal.27164 > 1353c458078e.http: Flags [.], ack 37492, win 391, options [nop,nop,TS val 24769440 ecr 1020265790], length 0
13:56:19.324173 IP ip-172-31-57-179.ec2.internal.27164 > 1353c458078e.http: Flags [.], ack 41836, win 375, options [nop,nop,TS val 24769440 ecr 1020265790], length 0
13:56:19.325118 IP ip-172-31-57-179.ec2.internal.27164 > 1353c458078e.http: Flags [.], ack 70796, win 270, options [nop,nop,TS val 24769440 ecr 1020265791], length 0
13:56:19.326264 IP ip-172-31-57-179.ec2.internal.27164 > 1353c458078e.http: Flags [.], ack 101204, win 261, options [nop,nop,TS val 24769441 ecr 1020265792], length 0
13:56:19.326906 IP ip-172-31-57-179.ec2.internal.27164 > 1353c458078e.http: Flags [.], ack 111284, win 391, options [nop,nop,TS val 24769441 ecr 1020265793], length 0
13:56:19.380703 IP ip-172-31-57-179.ec2.internal.27164 > 1353c458078e.http: Flags [.], ack 113647, win 382, options [nop,nop,TS val 24769454 ecr 1020265847], length 0
13:56:22.004041 IP ip-172-31-74-55.ec2.internal.30018 > 1353c458078e.http: Flags [F.], seq 533, ack 5518, win 151, options [nop,nop,TS val 639463061 ecr 2152350557], length 0
13:56:22.247838 IP ip-172-31-74-55.ec2.internal.30020 > 1353c458078e.http: Flags [F.], seq 1324, ack 596, win 110, options [nop,nop,TS val 639463122 ecr 2152350800], length 0
13:56:22.645442 IP ip-172-31-74-55.ec2.internal.30022 > 1353c458078e.http: Flags [S], seq 3266765342, win 26883, options [mss 8961,sackOK,TS val 639463222 ecr 0,nop,wscale 8], length 0
13:56:22.645668 IP ip-172-31-74-55.ec2.internal.30022 > 1353c458078e.http: Flags [.], ack 49429364, win 106, options [nop,nop,TS val 639463222 ecr 2152351199], length 0
13:56:22.645694 IP ip-172-31-74-55.ec2.internal.30022 > 1353c458078e.http: Flags [P.], seq 0:412, ack 1, win 106, options [nop,nop,TS val 639463222 ecr 2152351199], length 412: HTTP: GET /nutren-junior-400-g HTTP/1.1
13:56:22.850484 IP ip-172-31-74-55.ec2.internal.30024 > 1353c458078e.http: Flags [S], seq 3904845975, win 26883, options [mss 8961,sackOK,TS val 639463273 ecr 0,nop,wscale 8], length 0
13:56:22.850862 IP ip-172-31-74-55.ec2.internal.30024 > 1353c458078e.http: Flags [.], ack 1031915772, win 106, options [nop,nop,TS val 639463273 ecr 2152351404], length 0
13:56:22.850907 IP ip-172-31-74-55.ec2.internal.30024 > 1353c458078e.http: Flags [P.], seq 0:514, ack 1, win 106, options [nop,nop,TS val 639463273 ecr 2152351404], length 514: HTTP: GET /novasource-renal-1000-ml-sistema-fechado HTTP/1.1
13:56:23.360293 IP ip-172-31-74-55.ec2.internal.30022 > 1353c458078e.http: Flags [.], ack 2897, win 128, options [nop,nop,TS val 639463400 ecr 2152351913], length 0
13:56:23.360332 IP ip-172-31-74-55.ec2.internal.30022 > 1353c458078e.http: Flags [.], ack 5793, win 151, options [nop,nop,TS val 639463401 ecr 2152351913], length 0
13:56:23.360368 IP ip-172-31-74-55.ec2.internal.30022 > 1353c458078e.http: Flags [.], ack 8689, win 173, options [nop,nop,TS val 639463401 ecr 2152351913], length 0
13:56:23.360465 IP ip-172-31-74-55.ec2.internal.30022 > 1353c458078e.http: Flags [.], ack 10137, win 185, options [nop,nop,TS val 639463401 ecr 2152351913], length 0
13:56:23.360548 IP ip-172-31-74-55.ec2.internal.30022 > 1353c458078e.http: Flags [.], ack 14481, win 219, options [nop,nop,TS val 639463401 ecr 2152351913], length 0
13:56:23.360628 IP ip-172-31-74-55.ec2.internal.30022 > 1353c458078e.http: Flags [.], ack 18825, win 253, options [nop,nop,TS val 639463401 ecr 2152351913], length 0
13:56:23.360714 IP ip-172-31-74-55.ec2.internal.30022 > 1353c458078e.http: Flags [.], ack 20273, win 264, options [nop,nop,TS val 639463401 ecr 2152351913], length 0
13:56:23.360743 IP ip-172-31-74-55.ec2.internal.30022 > 1353c458078e.http: Flags [.], ack 21721, win 275, options [nop,nop,TS val 639463401 ecr 2152351913], length 0
13:56:23.360822 IP ip-172-31-74-55.ec2.internal.30022 > 1353c458078e.http: Flags [.], ack 26065, win 309, options [nop,nop,TS val 639463401 ecr 2152351913], length 0
13:56:23.360855 IP ip-172-31-74-55.ec2.internal.30022 > 1353c458078e.http: Flags [.], ack 27513, win 320, options [nop,nop,TS val 639463401 ecr 2152351913], length 0
13:56:23.360900 IP ip-172-31-74-55.ec2.internal.30022 > 1353c458078e.http: Flags [.], ack 28411, win 332, options [nop,nop,TS val 639463401 ecr 2152351913], length 0
13:56:23.450527 IP ip-172-31-74-55.ec2.internal.30024 > 1353c458078e.http: Flags [.], ack 1449, win 117, options [nop,nop,TS val 639463423 ecr 2152352003], length 0
13:56:23.450558 IP ip-172-31-74-55.ec2.internal.30024 > 1353c458078e.http: Flags [.], ack 4345, win 139, options [nop,nop,TS val 639463423 ecr 2152352003], length 0
13:56:23.450611 IP ip-172-31-74-55.ec2.internal.30024 > 1353c458078e.http: Flags [.], ack 7241, win 162, options [nop,nop,TS val 639463423 ecr 2152352003], length 0
13:56:23.450678 IP ip-172-31-74-55.ec2.internal.30024 > 1353c458078e.http: Flags [.], ack 8689, win 173, options [nop,nop,TS val 639463423 ecr 2152352003], length 0
13:56:23.450859 IP ip-172-31-74-55.ec2.internal.30024 > 1353c458078e.http: Flags [.], ack 14481, win 219, options [nop,nop,TS val 639463423 ecr 2152352003], length 0
13:56:23.451014 IP ip-172-31-74-55.ec2.internal.30024 > 1353c458078e.http: Flags [.], ack 17377, win 241, options [nop,nop,TS val 639463423 ecr 2152352004], length 0
13:56:23.451057 IP ip-172-31-74-55.ec2.internal.30024 > 1353c458078e.http: Flags [.], ack 24617, win 298, options [nop,nop,TS val 639463423 ecr 2152352004], length 0
13:56:23.451094 IP ip-172-31-74-55.ec2.internal.30024 > 1353c458078e.http: Flags [.], ack 24926, win 309, options [nop,nop,TS val 639463423 ecr 2152352004], length 0
13:56:24.382242 IP ip-172-31-57-179.ec2.internal.27164 > 1353c458078e.http: Flags [F.], seq 3264, ack 113648, win 405, options [nop,nop,TS val 24770705 ecr 1020270849], length 0
13:56:27.661404 IP ip-172-31-57-179.ec2.internal.27166 > 1353c458078e.http: Flags [S], seq 2791874781, win 26883, options [mss 8961,sackOK,TS val 24771524 ecr 0,nop,wscale 8], length 0
13:56:27.662065 IP ip-172-31-57-179.ec2.internal.27166 > 1353c458078e.http: Flags [.], ack 3728746349, win 106, options [nop,nop,TS val 24771525 ecr 1020274128], length 0
13:56:27.662123 IP ip-172-31-57-179.ec2.internal.27166 > 1353c458078e.http: Flags [P.], seq 0:982, ack 1, win 106, options [nop,nop,TS val 24771525 ecr 1020274128], length 982: HTTP: GET /session.php HTTP/1.1
13:56:27.850009 IP ip-172-31-57-179.ec2.internal.27166 > 1353c458078e.http: Flags [.], ack 595, win 110, options [nop,nop,TS val 24771572 ecr 1020274316], length 0
13:56:28.360326 IP ip-172-31-74-55.ec2.internal.30024 > 1353c458078e.http: Flags [F.], seq 514, ack 24927, win 309, options [nop,nop,TS val 639464651 ecr 2152356913], length 0
13:56:28.360349 IP ip-172-31-74-55.ec2.internal.30022 > 1353c458078e.http: Flags [F.], seq 412, ack 28412, win 332, options [nop,nop,TS val 639464651 ecr 2152356913], length 0
13:56:28.996234 IP ip-172-31-74-55.ec2.internal.30028 > 1353c458078e.http: Flags [S], seq 3079544129, win 26883, options [mss 8961,sackOK,TS val 639464809 ecr 0,nop,wscale 8], length 0
13:56:28.996448 IP ip-172-31-74-55.ec2.internal.30028 > 1353c458078e.http: Flags [.], ack 2922763911, win 106, options [nop,nop,TS val 639464810 ecr 2152357549], length 0
13:56:28.996484 IP ip-172-31-74-55.ec2.internal.30028 > 1353c458078e.http: Flags [P.], seq 0:435, ack 1, win 106, options [nop,nop,TS val 639464810 ecr 2152357549], length 435: HTTP: GET /marcas/modulen HTTP/1.1
13:56:29.610175 IP ip-172-31-74-55.ec2.internal.30028 > 1353c458078e.http: Flags [.], ack 1449, win 117, options [nop,nop,TS val 639464963 ecr 2152358163], length 0
13:56:29.610187 IP ip-172-31-74-55.ec2.internal.30028 > 1353c458078e.http: Flags [.], ack 2897, win 128, options [nop,nop,TS val 639464963 ecr 2152358163], length 0
13:56:29.610211 IP ip-172-31-74-55.ec2.internal.30028 > 1353c458078e.http: Flags [.], ack 4345, win 139, options [nop,nop,TS val 639464963 ecr 2152358163], length 0
13:56:29.610323 IP ip-172-31-74-55.ec2.internal.30028 > 1353c458078e.http: Flags [.], ack 7241, win 162, options [nop,nop,TS val 639464963 ecr 2152358163], length 0
13:56:29.610379 IP ip-172-31-74-55.ec2.internal.30028 > 1353c458078e.http: Flags [.], ack 10137, win 185, options [nop,nop,TS val 639464963 ecr 2152358163], length 0
13:56:29.610440 IP ip-172-31-74-55.ec2.internal.30028 > 1353c458078e.http: Flags [.], ack 13033, win 207, options [nop,nop,TS val 639464963 ecr 2152358163], length 0
13:56:29.610504 IP ip-172-31-74-55.ec2.internal.30028 > 1353c458078e.http: Flags [.], ack 14481, win 219, options [nop,nop,TS val 639464963 ecr 2152358163], length 0
13:56:29.610538 IP ip-172-31-74-55.ec2.internal.30028 > 1353c458078e.http: Flags [.], ack 17377, win 241, options [nop,nop,TS val 639464963 ecr 2152358163], length 0
13:56:29.610564 IP ip-172-31-74-55.ec2.internal.30028 > 1353c458078e.http: Flags [.], ack 21538, win 274, options [nop,nop,TS val 639464963 ecr 2152358163], length 0
13:56:30.486093 IP ip-172-31-57-179.ec2.internal.27168 > 1353c458078e.http: Flags [S], seq 1824459026, win 26883, options [mss 8961,sackOK,TS val 24772231 ecr 0,nop,wscale 8], length 0
13:56:30.486662 IP ip-172-31-57-179.ec2.internal.27168 > 1353c458078e.http: Flags [.], ack 3037419542, win 106, options [nop,nop,TS val 24772231 ecr 1020276953], length 0
13:56:30.486688 IP ip-172-31-57-179.ec2.internal.27168 > 1353c458078e.http: Flags [P.], seq 0:522, ack 1, win 106, options [nop,nop,TS val 24772231 ecr 1020276953], length 522: HTTP: GET /media/catalog/product/cache/1/small_image/263x/0dc2d03fe217f8c83829496872af24a0/M/o/Modulen---400g_7.jpg HTTP/1.1
13:56:30.491144 IP ip-172-31-57-179.ec2.internal.27168 > 1353c458078e.http: Flags [.], ack 5748, win 150, options [nop,nop,TS val 24772232 ecr 1020276957], length 0
13:56:30.581285 IP ip-172-31-57-179.ec2.internal.27166 > 1353c458078e.http: Flags [P.], seq 982:2304, ack 595, win 110, options [nop,nop,TS val 24772254 ecr 1020274316], length 1322: HTTP: GET /session.php HTTP/1.1
13:56:30.773614 IP ip-172-31-57-179.ec2.internal.27166 > 1353c458078e.http: Flags [.], ack 1189, win 115, options [nop,nop,TS val 24772302 ecr 1020277240], length 0
13:56:32.075631 IP ip-172-31-57-179.ec2.internal.27166 > 1353c458078e.http: Flags [P.], seq 2304:3098, ack 1189, win 115, options [nop,nop,TS val 24772628 ecr 1020277240], length 794: HTTP: GET /session.php HTTP/1.1
13:56:32.262409 IP ip-172-31-57-179.ec2.internal.27166 > 1353c458078e.http: Flags [.], ack 1783, win 119, options [nop,nop,TS val 24772675 ecr 1020278729], length 0
13:56:34.229662 IP ip-172-31-57-179.ec2.internal.27168 > 1353c458078e.http: Flags [P.], seq 522:1613, ack 5748, win 150, options [nop,nop,TS val 24773166 ecr 1020276957], length 1091: HTTP: GET /session.php HTTP/1.1
13:56:34.425478 IP ip-172-31-57-179.ec2.internal.27168 > 1353c458078e.http: Flags [.], ack 6342, win 162, options [nop,nop,TS val 24773215 ecr 1020280892], length 0
13:56:34.610515 IP ip-172-31-74-55.ec2.internal.30028 > 1353c458078e.http: Flags [F.], seq 435, ack 21539, win 274, options [nop,nop,TS val 639466213 ecr 2152363163], length 0
13:56:37.264956 IP ip-172-31-57-179.ec2.internal.27166 > 1353c458078e.http: Flags [F.], seq 3098, ack 1784, win 119, options [nop,nop,TS val 24773925 ecr 1020283731], length 0
13:56:39.426953 IP ip-172-31-57-179.ec2.internal.27168 > 1353c458078e.http: Flags [F.], seq 1613, ack 6343, win 162, options [nop,nop,TS val 24774466 ecr 1020285893], length 0
13:56:40.084596 IP ip-172-31-74-55.ec2.internal.30032 > 1353c458078e.http: Flags [S], seq 4110407136, win 26883, options [mss 8961,sackOK,TS val 639467582 ecr 0,nop,wscale 8], length 0
13:56:40.084827 IP ip-172-31-74-55.ec2.internal.30032 > 1353c458078e.http: Flags [.], ack 1956888046, win 106, options [nop,nop,TS val 639467582 ecr 2152368638], length 0
13:56:40.084852 IP ip-172-31-74-55.ec2.internal.30032 > 1353c458078e.http: Flags [P.], seq 0:1035, ack 1, win 106, options [nop,nop,TS val 639467582 ecr 2152368638], length 1035: HTTP: GET /session.php HTTP/1.1
13:56:40.270224 IP ip-172-31-74-55.ec2.internal.30032 > 1353c458078e.http: Flags [.], ack 595, win 110, options [nop,nop,TS val 639467628 ecr 2152368823], length 0
13:56:42.457772 IP ip-172-31-57-179.ec2.internal.27174 > 1353c458078e.http: Flags [S], seq 1399342894, win 26883, options [mss 8961,sackOK,TS val 24775223 ecr 0,nop,wscale 8], length 0
13:56:42.458379 IP ip-172-31-57-179.ec2.internal.27174 > 1353c458078e.http: Flags [.], ack 1002945203, win 106, options [nop,nop,TS val 24775224 ecr 1020288925], length 0
13:56:42.458427 IP ip-172-31-57-179.ec2.internal.27174 > 1353c458078e.http: Flags [P.], seq 0:395, ack 1, win 106, options [nop,nop,TS val 24775224 ecr 1020288925], length 395: HTTP: GET /erro HTTP/1.1
13:56:43.065579 IP ip-172-31-57-179.ec2.internal.27174 > 1353c458078e.http: Flags [.], ack 8732, win 174, options [nop,nop,TS val 24775375 ecr 1020289532], length 0
13:56:43.065599 IP ip-172-31-57-179.ec2.internal.27174 > 1353c458078e.http: Flags [.], ack 13076, win 208, options [nop,nop,TS val 24775375 ecr 1020289532], length 0
13:56:43.066570 IP ip-172-31-57-179.ec2.internal.27174 > 1353c458078e.http: Flags [.], ack 42036, win 270, options [nop,nop,TS val 24775376 ecr 1020289533], length 0
13:56:43.067592 IP ip-172-31-57-179.ec2.internal.27174 > 1353c458078e.http: Flags [.], ack 72444, win 610, options [nop,nop,TS val 24775376 ecr 1020289534], length 0
13:56:43.068252 IP ip-172-31-57-179.ec2.internal.27174 > 1353c458078e.http: Flags [.], ack 82524, win 738, options [nop,nop,TS val 24775376 ecr 1020289535], length 0
13:56:43.085725 IP ip-172-31-57-179.ec2.internal.27174 > 1353c458078e.http: Flags [.], ack 84887, win 729, options [nop,nop,TS val 24775380 ecr 1020289552], length 0
13:56:44.537438 IP ip-172-31-57-179.ec2.internal.27176 > 1353c458078e.http: Flags [S], seq 2417922954, win 26883, options [mss 8961,sackOK,TS val 24775743 ecr 0,nop,wscale 8], length 0
13:56:44.537958 IP ip-172-31-57-179.ec2.internal.27176 > 1353c458078e.http: Flags [.], ack 928063791, win 106, options [nop,nop,TS val 24775744 ecr 1020291004], length 0
13:56:44.538035 IP ip-172-31-57-179.ec2.internal.27176 > 1353c458078e.http: Flags [P.], seq 0:396, ack 1, win 106, options [nop,nop,TS val 24775744 ecr 1020291004], length 396: HTTP: GET /erro HTTP/1.1
13:56:45.159582 IP ip-172-31-57-179.ec2.internal.27176 > 1353c458078e.http: Flags [.], ack 8732, win 174, options [nop,nop,TS val 24775899 ecr 1020291626], length 0
13:56:45.159607 IP ip-172-31-57-179.ec2.internal.27176 > 1353c458078e.http: Flags [.], ack 13076, win 208, options [nop,nop,TS val 24775899 ecr 1020291626], length 0
13:56:45.160564 IP ip-172-31-57-179.ec2.internal.27176 > 1353c458078e.http: Flags [.], ack 42036, win 270, options [nop,nop,TS val 24775899 ecr 1020291627], length 0
13:56:45.161577 IP ip-172-31-57-179.ec2.internal.27176 > 1353c458078e.http: Flags [.], ack 72444, win 261, options [nop,nop,TS val 24775899 ecr 1020291628], length 0
13:56:45.162264 IP ip-172-31-57-179.ec2.internal.27176 > 1353c458078e.http: Flags [.], ack 82524, win 391, options [nop,nop,TS val 24775900 ecr 1020291629], length 0
13:56:45.180043 IP ip-172-31-57-179.ec2.internal.27176 > 1353c458078e.http: Flags [.], ack 84887, win 440, options [nop,nop,TS val 24775904 ecr 1020291646], length 0
13:56:45.270337 IP ip-172-31-74-55.ec2.internal.30032 > 1353c458078e.http: Flags [F.], seq 1035, ack 596, win 110, options [nop,nop,TS val 639468878 ecr 2152373823], length 0
13:56:48.088377 IP ip-172-31-57-179.ec2.internal.27174 > 1353c458078e.http: Flags [F.], seq 395, ack 84888, win 738, options [nop,nop,TS val 24776631 ecr 1020294555], length 0
13:56:49.786725 IP ip-172-31-74-55.ec2.internal.30034 > 1353c458078e.http: Flags [S], seq 1286046971, win 26883, options [mss 8961,sackOK,TS val 639470007 ecr 0,nop,wscale 8], length 0
13:56:49.786940 IP ip-172-31-74-55.ec2.internal.30034 > 1353c458078e.http: Flags [.], ack 3052101587, win 106, options [nop,nop,TS val 639470007 ecr 2152378340], length 0
13:56:49.786974 IP ip-172-31-74-55.ec2.internal.30034 > 1353c458078e.http: Flags [P.], seq 0:395, ack 1, win 106, options [nop,nop,TS val 639470007 ecr 2152378340], length 395: HTTP: GET /erro HTTP/1.1
13:56:50.180133 IP ip-172-31-57-179.ec2.internal.27176 > 1353c458078e.http: Flags [F.], seq 396, ack 84888, win 440, options [nop,nop,TS val 24777154 ecr 1020296646], length 0
13:56:50.379980 IP ip-172-31-74-55.ec2.internal.30034 > 1353c458078e.http: Flags [.], ack 2897, win 128, options [nop,nop,TS val 639470155 ecr 2152378933], length 0
13:56:50.379998 IP ip-172-31-74-55.ec2.internal.30034 > 1353c458078e.http: Flags [.], ack 4345, win 139, options [nop,nop,TS val 639470155 ecr 2152378933], length 0
13:56:50.380015 IP ip-172-31-74-55.ec2.internal.30034 > 1353c458078e.http: Flags [.], ack 5793, win 151, options [nop,nop,TS val 639470155 ecr 2152378933], length 0
13:56:50.380129 IP ip-172-31-74-55.ec2.internal.30034 > 1353c458078e.http: Flags [.], ack 8732, win 174, options [nop,nop,TS val 639470155 ecr 2152378933], length 0
13:56:50.380240 IP ip-172-31-74-55.ec2.internal.30034 > 1353c458078e.http: Flags [.], ack 13076, win 208, options [nop,nop,TS val 639470156 ecr 2152378933], length 0
13:56:50.380265 IP ip-172-31-74-55.ec2.internal.30034 > 1353c458078e.http: Flags [.], ack 14524, win 219, options [nop,nop,TS val 639470156 ecr 2152378933], length 0
13:56:50.380319 IP ip-172-31-74-55.ec2.internal.30034 > 1353c458078e.http: Flags [.], ack 17420, win 242, options [nop,nop,TS val 639470156 ecr 2152378933], length 0
13:56:50.380358 IP ip-172-31-74-55.ec2.internal.30034 > 1353c458078e.http: Flags [.], ack 20316, win 264, options [nop,nop,TS val 639470156 ecr 2152378933], length 0
13:56:50.380381 IP ip-172-31-74-55.ec2.internal.30034 > 1353c458078e.http: Flags [.], ack 21764, win 276, options [nop,nop,TS val 639470156 ecr 2152378933], length 0
13:56:50.380409 IP ip-172-31-74-55.ec2.internal.30034 > 1353c458078e.http: Flags [.], ack 23212, win 287, options [nop,nop,TS val 639470156 ecr 2152378933], length 0
13:56:50.380439 IP ip-172-31-74-55.ec2.internal.30034 > 1353c458078e.http: Flags [.], ack 24660, win 298, options [nop,nop,TS val 639470156 ecr 2152378933], length 0
13:56:50.380463 IP ip-172-31-74-55.ec2.internal.30034 > 1353c458078e.http: Flags [.], ack 26108, win 309, options [nop,nop,TS val 639470156 ecr 2152378933], length 0
13:56:50.380507 IP ip-172-31-74-55.ec2.internal.30034 > 1353c458078e.http: Flags [.], ack 27556, win 321, options [nop,nop,TS val 639470156 ecr 2152378933], length 0
13:56:50.380520 IP ip-172-31-74-55.ec2.internal.30034 > 1353c458078e.http: Flags [.], ack 29004, win 332, options [nop,nop,TS val 639470156 ecr 2152378933], length 0
13:56:50.380549 IP ip-172-31-74-55.ec2.internal.30034 > 1353c458078e.http: Flags [.], ack 30452, win 343, options [nop,nop,TS val 639470156 ecr 2152378933], length 0
13:56:50.380576 IP ip-172-31-74-55.ec2.internal.30034 > 1353c458078e.http: Flags [.], ack 31900, win 355, options [nop,nop,TS val 639470156 ecr 2152378933], length 0
13:56:50.380603 IP ip-172-31-74-55.ec2.internal.30034 > 1353c458078e.http: Flags [.], ack 33348, win 366, options [nop,nop,TS val 639470156 ecr 2152378933], length 0
13:56:50.380632 IP ip-172-31-74-55.ec2.internal.30034 > 1353c458078e.http: Flags [.], ack 34796, win 377, options [nop,nop,TS val 639470156 ecr 2152378933], length 0
13:56:50.380672 IP ip-172-31-74-55.ec2.internal.30034 > 1353c458078e.http: Flags [.], ack 36244, win 389, options [nop,nop,TS val 639470156 ecr 2152378933], length 0
13:56:50.380701 IP ip-172-31-74-55.ec2.internal.30034 > 1353c458078e.http: Flags [.], ack 37692, win 400, options [nop,nop,TS val 639470156 ecr 2152378933], length 0
13:56:50.380730 IP ip-172-31-74-55.ec2.internal.30034 > 1353c458078e.http: Flags [.], ack 39140, win 411, options [nop,nop,TS val 639470156 ecr 2152378933], length 0
13:56:50.380772 IP ip-172-31-74-55.ec2.internal.30034 > 1353c458078e.http: Flags [.], ack 40588, win 422, options [nop,nop,TS val 639470156 ecr 2152378933], length 0
13:56:50.380813 IP ip-172-31-74-55.ec2.internal.30034 > 1353c458078e.http: Flags [.], ack 42036, win 422, options [nop,nop,TS val 639470156 ecr 2152378933], length 0
13:56:50.380851 IP ip-172-31-74-55.ec2.internal.30034 > 1353c458078e.http: Flags [.], ack 43484, win 422, options [nop,nop,TS val 639470156 ecr 2152378933], length 0
13:56:50.380877 IP ip-172-31-74-55.ec2.internal.30034 > 1353c458078e.http: Flags [.], ack 44932, win 422, options [nop,nop,TS val 639470156 ecr 2152378933], length 0
13:56:50.380905 IP ip-172-31-74-55.ec2.internal.30034 > 1353c458078e.http: Flags [.], ack 46380, win 422, options [nop,nop,TS val 639470156 ecr 2152378933], length 0
13:56:50.380934 IP ip-172-31-74-55.ec2.internal.30034 > 1353c458078e.http: Flags [.], ack 47828, win 422, options [nop,nop,TS val 639470156 ecr 2152378933], length 0
13:56:50.380969 IP ip-172-31-74-55.ec2.internal.30034 > 1353c458078e.http: Flags [.], ack 49276, win 422, options [nop,nop,TS val 639470156 ecr 2152378933], length 0
13:56:50.380995 IP ip-172-31-74-55.ec2.internal.30034 > 1353c458078e.http: Flags [.], ack 50724, win 422, options [nop,nop,TS val 639470156 ecr 2152378933], length 0
13:56:50.381041 IP ip-172-31-74-55.ec2.internal.30034 > 1353c458078e.http: Flags [.], ack 52172, win 422, options [nop,nop,TS val 639470156 ecr 2152378933], length 0
13:56:50.381093 IP ip-172-31-74-55.ec2.internal.30034 > 1353c458078e.http: Flags [.], ack 55068, win 422, options [nop,nop,TS val 639470156 ecr 2152378934], length 0
13:56:50.381156 IP ip-172-31-74-55.ec2.internal.30034 > 1353c458078e.http: Flags [.], ack 57964, win 422, options [nop,nop,TS val 639470156 ecr 2152378934], length 0
13:56:50.381212 IP ip-172-31-74-55.ec2.internal.30034 > 1353c458078e.http: Flags [.], ack 60860, win 422, options [nop,nop,TS val 639470156 ecr 2152378934], length 0
13:56:50.381274 IP ip-172-31-74-55.ec2.internal.30034 > 1353c458078e.http: Flags [.], ack 63756, win 422, options [nop,nop,TS val 639470156 ecr 2152378934], length 0
13:56:50.381331 IP ip-172-31-74-55.ec2.internal.30034 > 1353c458078e.http: Flags [.], ack 66652, win 422, options [nop,nop,TS val 639470156 ecr 2152378934], length 0
13:56:50.381375 IP ip-172-31-74-55.ec2.internal.30034 > 1353c458078e.http: Flags [.], ack 69548, win 422, options [nop,nop,TS val 639470156 ecr 2152378934], length 0
13:56:50.381428 IP ip-172-31-74-55.ec2.internal.30034 > 1353c458078e.http: Flags [.], ack 73892, win 422, options [nop,nop,TS val 639470156 ecr 2152378934], length 0
13:56:50.381480 IP ip-172-31-74-55.ec2.internal.30034 > 1353c458078e.http: Flags [.], ack 78236, win 422, options [nop,nop,TS val 639470156 ecr 2152378934], length 0
13:56:50.381533 IP ip-172-31-74-55.ec2.internal.30034 > 1353c458078e.http: Flags [.], ack 81132, win 422, options [nop,nop,TS val 639470156 ecr 2152378934], length 0
13:56:50.381558 IP ip-172-31-74-55.ec2.internal.30034 > 1353c458078e.http: Flags [.], ack 82524, win 422, options [nop,nop,TS val 639470156 ecr 2152378934], length 0
13:56:50.400884 IP ip-172-31-74-55.ec2.internal.30034 > 1353c458078e.http: Flags [.], ack 84887, win 422, options [nop,nop,TS val 639470161 ecr 2152378954], length 0
13:56:53.642212 IP ip-172-31-74-55.ec2.internal.30034 > 1353c458078e.http: Flags [P.], seq 395:895, ack 84887, win 422, options [nop,nop,TS val 639470971 ecr 2152378954], length 500: HTTP: GET /hidrosteril-50ml?gclid=EAIaIQobChMIh5DyuoP52wIVgw2RCh0TZgknEAYYASABEgJV9fD_BwE HTTP/1.1
13:56:54.239115 IP ip-172-31-74-55.ec2.internal.30034 > 1353c458078e.http: Flags [.], ack 89231, win 456, options [nop,nop,TS val 639471120 ecr 2152382792], length 0
13:56:54.239138 IP ip-172-31-74-55.ec2.internal.30034 > 1353c458078e.http: Flags [.], ack 95023, win 501, options [nop,nop,TS val 639471120 ecr 2152382792], length 0
13:56:54.239165 IP ip-172-31-74-55.ec2.internal.30034 > 1353c458078e.http: Flags [.], ack 97919, win 524, options [nop,nop,TS val 639471120 ecr 2152382792], length 0
13:56:54.239191 IP ip-172-31-74-55.ec2.internal.30034 > 1353c458078e.http: Flags [.], ack 99367, win 535, options [nop,nop,TS val 639471120 ecr 2152382792], length 0
13:56:54.239352 IP ip-172-31-74-55.ec2.internal.30034 > 1353c458078e.http: Flags [.], ack 100815, win 546, options [nop,nop,TS val 639471120 ecr 2152382792], length 0
13:56:54.239433 IP ip-172-31-74-55.ec2.internal.30034 > 1353c458078e.http: Flags [.], ack 103711, win 569, options [nop,nop,TS val 639471120 ecr 2152382792], length 0
13:56:54.239446 IP ip-172-31-74-55.ec2.internal.30034 > 1353c458078e.http: Flags [.], ack 109503, win 614, options [nop,nop,TS val 639471120 ecr 2152382792], length 0
13:56:54.239473 IP ip-172-31-74-55.ec2.internal.30034 > 1353c458078e.http: Flags [.], ack 111313, win 628, options [nop,nop,TS val 639471120 ecr 2152382792], length 0
13:56:59.072587 IP ip-172-31-57-179.ec2.internal.27178 > 1353c458078e.http: Flags [S], seq 2532723744, win 26883, options [mss 8961,sackOK,TS val 24779377 ecr 0,nop,wscale 8], length 0
13:56:59.073177 IP ip-172-31-57-179.ec2.internal.27178 > 1353c458078e.http: Flags [.], ack 3233292144, win 106, options [nop,nop,TS val 24779377 ecr 1020305540], length 0
13:56:59.073280 IP ip-172-31-57-179.ec2.internal.27178 > 1353c458078e.http: Flags [P.], seq 0:1080, ack 1, win 106, options [nop,nop,TS val 24779377 ecr 1020305540], length 1080: HTTP: GET /session.php HTTP/1.1
13:56:59.110651 IP ip-172-31-57-179.ec2.internal.27180 > 1353c458078e.http: Flags [S], seq 2803971653, win 26883, options [mss 8961,sackOK,TS val 24779387 ecr 0,nop,wscale 8], length 0
13:56:59.111349 IP ip-172-31-57-179.ec2.internal.27180 > 1353c458078e.http: Flags [.], ack 1104479105, win 106, options [nop,nop,TS val 24779387 ecr 1020305578], length 0
13:56:59.111391 IP ip-172-31-57-179.ec2.internal.27180 > 1353c458078e.http: Flags [P.], seq 0:208, ack 1, win 106, options [nop,nop,TS val 24779387 ecr 1020305578], length 208: HTTP: GET /api/v2_soap/?wsdl HTTP/1.1
13:56:59.239215 IP ip-172-31-74-55.ec2.internal.30034 > 1353c458078e.http: Flags [F.], seq 895, ack 111314, win 628, options [nop,nop,TS val 639472370 ecr 2152387792], length 0
13:56:59.357929 IP ip-172-31-57-179.ec2.internal.27178 > 1353c458078e.http: Flags [.], ack 595, win 110, options [nop,nop,TS val 24779449 ecr 1020305824], length 0
13:57:01.995861 IP ip-172-31-57-179.ec2.internal.27180 > 1353c458078e.http: Flags [.], ack 8429, win 171, options [nop,nop,TS val 24780108 ecr 1020308462], length 0
13:57:01.995889 IP ip-172-31-57-179.ec2.internal.27180 > 1353c458078e.http: Flags [.], ack 14221, win 217, options [nop,nop,TS val 24780108 ecr 1020308462], length 0
13:57:01.997089 IP ip-172-31-57-179.ec2.internal.27180 > 1353c458078e.http: Flags [.], ack 15669, win 228, options [nop,nop,TS val 24780108 ecr 1020308463], length 0
13:57:01.997225 IP ip-172-31-57-179.ec2.internal.27180 > 1353c458078e.http: Flags [.], ack 43181, win 279, options [nop,nop,TS val 24780108 ecr 1020308463], length 0
13:57:01.997778 IP ip-172-31-57-179.ec2.internal.27180 > 1353c458078e.http: Flags [.], ack 44629, win 422, options [nop,nop,TS val 24780109 ecr 1020308464], length 0
13:57:01.998375 IP ip-172-31-57-179.ec2.internal.27180 > 1353c458078e.http: Flags [.], ack 73589, win 648, options [nop,nop,TS val 24780109 ecr 1020308464], length 0
13:57:01.999385 IP ip-172-31-57-179.ec2.internal.27180 > 1353c458078e.http: Flags [.], ack 105445, win 897, options [nop,nop,TS val 24780109 ecr 1020308465], length 0
13:57:02.000527 IP ip-172-31-57-179.ec2.internal.27180 > 1353c458078e.http: Flags [.], ack 138749, win 1047, options [nop,nop,TS val 24780109 ecr 1020308466], length 0
13:57:02.001529 IP ip-172-31-57-179.ec2.internal.27180 > 1353c458078e.http: Flags [.], ack 140197, win 1042, options [nop,nop,TS val 24780109 ecr 1020308467], length 0
13:57:02.001637 IP ip-172-31-57-179.ec2.internal.27180 > 1353c458078e.http: Flags [.], ack 173501, win 912, options [nop,nop,TS val 24780109 ecr 1020308467], length 0
13:57:02.045799 IP ip-172-31-57-179.ec2.internal.27180 > 1353c458078e.http: Flags [.], ack 211149, win 765, options [nop,nop,TS val 24780121 ecr 1020308469], length 0
13:57:02.089747 IP ip-172-31-57-179.ec2.internal.27180 > 1353c458078e.http: Flags [.], ack 247509, win 623, options [nop,nop,TS val 24780132 ecr 1020308513,nop,nop,sack 1 {247349:247509}], length 0
13:57:02.812205 IP ip-172-31-57-179.ec2.internal.27182 > 1353c458078e.http: Flags [S], seq 356761415, win 26883, options [mss 8961,sackOK,TS val 24780312 ecr 0,nop,wscale 8], length 0
13:57:02.812800 IP ip-172-31-57-179.ec2.internal.27182 > 1353c458078e.http: Flags [.], ack 1531207755, win 106, options [nop,nop,TS val 24780312 ecr 1020309279], length 0
